{
  "$schema": "./specification.schema.json",
  "repository": "https://github.com/CarterShi01/contexture-mcp",
  "revision": "e107a81a933c5eb5b4530e762311619be3a7a80f",
  "specificationVersion": "0.12",
  "status": "partial",
  "implementedRules": [1, 2, 3, 4, 5, 12, 13, 14, 16],
  "rules": {
    "1": { "status": "implemented", "evidence": ["test/declarations.test.ts"] },
    "2": { "status": "implemented", "evidence": ["test/compiler.test.ts"] },
    "3": {
      "status": "implemented",
      "evidence": ["test/declarations.test.ts", "test/compiler.test.ts"]
    },
    "4": { "status": "implemented", "evidence": ["test/binding.test.ts"] },
    "5": { "status": "implemented", "evidence": ["test/server.test.ts"] },
    "6": { "status": "in-progress", "evidence": ["test/disclosure.test.ts"] },
    "7": { "status": "in-progress", "evidence": ["test/disclosure.test.ts"] },
    "8": { "status": "not-started", "evidence": [] },
    "9": { "status": "in-progress", "evidence": ["test/disclosure.test.ts"] },
    "10": { "status": "in-progress", "evidence": ["test/disclosure.test.ts"] },
    "11": { "status": "not-started", "evidence": [] },
    "12": { "status": "implemented", "evidence": ["test/lifecycle.test.ts"] },
    "13": {
      "status": "implemented",
      "evidence": ["test/lifecycle.test.ts", "test/publications.test.ts"]
    },
    "14": { "status": "implemented", "evidence": ["test/rest.test.ts"] },
    "15": { "status": "in-progress", "evidence": ["test/runtime.test.ts"] },
    "16": { "status": "implemented", "evidence": ["test/layering.test.ts"] }
  },
  "fixtures": [
    "disclosure-only-application.json",
    "prompt-roots-application.json",
    "reference-application.json",
    "rest-routes.json",
    "root-selections.json"
  ],
  "golden": [
    "commands.json",
    "completions.json",
    "discover.json",
    "instructions.txt",
    "open.json",
    "prompts.json",
    "reads.json",
    "refusals.json",
    "resources.json",
    "tools.json"
  ],
  "notes": "Only lazy application declaration is implemented. No package release may claim full conformance yet."
}
